187,4151,Sales administrators,68,79,76149,Administrative And Secretarial Occupations,grp4
139,3415,Musicians,68,80,50001,Associate Professional And Technical Occupations,grp3
359,9244,School midday and crossing patrol occupations,68,92,90525,Elementary Occupations,grp9
218,5236,Boat and ship builders and repairers,68.44444444,46,13709,Skilled Trades Occupations,grp5
219,5237,Rail and rolling stock builders and repairers,68.44444444,87,9046,Skilled Trades Occupations,grp5
211,5223,Metal working production and maintenance fitters,68.44444444,93,214364,Skilled Trades Occupations,grp5
326,8149,Construction operatives,68.5,52,11623,"Process, Plant And Machine Operatives",grp8
204,5212,"Moulders, core makers and die casters",68.5,78,*,Skilled Trades Occupations,grp5
231,5316,"Glaziers, window fabricators and fitters",69,31,36156,Skilled Trades Occupations,grp5
361,9251,Shelf fillers,69,31,109680,Elementary Occupations,grp9
213,5225,Air-conditioning and refrigeration engineers,69,88,18109,Skilled Trades Occupations,grp5
75,2314,Secondary education teaching professionals,70,27,382152,Professional Occupations,grp2
346,9134,"Packers, bottlers, canners and fillers",70,81,128392,Elementary Occupations,grp9
323,8141,"Scaffolders, stagers and riggers",70.5,14,35195,"Process, Plant And Machine Operatives",grp8
275,6219,Leisure and travel service occupations,70.66666667,66,22859,"Caring, Leisure And Other Service Occupations",grp6
236,5330,Construction and building trades supervisors,71,96,47196,Skilled Trades Occupations,grp5
365,9272,Kitchen and catering assistants,71.33333333,38,507275,Elementary Occupations,grp9
271,6211,Sports and leisure assistants,71.48333333,49,72122,"Caring, Leisure And Other Service Occupations",grp6
270,6148,"Undertakers, mortuary and crematorium assistants",71.5,75,18021,"Caring, Leisure And Other Service Occupations",grp6
220,5241,Electricians and electrical fitters,71.5,79,265160,Skilled Trades Occupations,grp5
60,2213,Pharmacists,72,65,65791,Professional Occupations,grp2
165,3546,Conference and exhibition managers and organisers,72,94,82090,Associate Professional And Technical Occupations,grp3
282,7112,Retail cashiers and check-out operators,72.5,54,200315,Sales And Customer Service Occupations,grp7
206,5214,"Metal plate workers, and riveters",72.66666667,7,7096,Skilled Trades Occupations,grp5
226,5311,Steel erectors,72.66666667,86,8197,Skilled Trades Occupations,grp5
296,7215,Market research interviewers,73,5,10296,Sales And Customer Service Occupations,grp7
69,2223,Speech and language therapists,73,33,14617,Professional Occupations,grp2
145,3442,"Sports coaches, instructors and officials",73.66666667,28,109166,Associate Professional And Technical Occupations,grp3
329,8213,Bus and coach drivers,73.75,0,137562,"Process, Plant And Machine Operatives",grp8
147,3511,Air traffic controllers,74,81,*,Associate Professional And Technical Occupations,grp3
337,8232,Marine and waterways transport operatives,74,93,7963,"Process, Plant And Machine Operatives",grp8
76,2315,Primary and nursery education teaching professionals,74.5,79,424876,Professional Occupations,grp2
366,9273,Waiters and waitresses,75,11,261349,Elementary Occupations,grp9
284,7114,Pharmacy and other dispensing assistants,75.5,52,80347,Sales And Customer Service Occupations,grp7
262,6139,Animal care services occupations,75.75,26,5628,"Caring, Leisure And Other Service Occupations",grp6
328,8212,Van drivers,75.8,12,275638,"Process, Plant And Machine Operatives",grp8
330,8214,Taxi and cab drivers and chauffeurs,75.8,50,207697,"Process, Plant And Machine Operatives",grp8
343,9119,Fishing and other elementary agriculture occupations,76,4,7500,Elementary Occupations,grp9
138,3414,Dancers and choreographers,76,10,20897,Associate Professional And Technical Occupations,grp3
27,1225,Leisure and sports managers,76,21,67218,"Managers, Directors And Senior Officials",grp1
132,3314,Prison service officers (below principal officer),76,29,41436,Associate Professional And Technical Occupations,grp3
331,8215,Driving instructors,76,61,40764,"Process, Plant And Machine Operatives",grp8
325,8143,Rail construction and maintenance operatives,76.5,2,11623,"Process, Plant And Machine Operatives",grp8
324,8142,Road construction operatives,76.5,38,20853,"Process, Plant And Machine Operatives",grp8
148,3512,Aircraft pilots and flight engineers,76.66666667,62,25036,Associate Professional And Technical Occupations,grp3
17,1172,Senior police officers,77,1,10098,"Managers, Directors And Senior Officials",grp1
283,7113,Telephone salespersons,77,3,25335,Sales And Customer Service Occupations,grp7
228,5313,"Roofers, roof tilers and slaters",77,48,39435,Skilled Trades Occupations,grp5
74,2312,Further education teaching professionals,77,65,116184,Professional Occupations,grp2
357,9241,Security guards and related occupations,77.33333333,70,202350,Elementary Occupations,grp9
133,3315,Police community support officers,78,16,19252,Associate Professional And Technical Occupations,grp3
25,1223,Restaurant and catering establishment managers and proprietors,78,61,126695,"Managers, Directors And Senior Officials",grp1
130,3312,Police officers (sergeant and below),78,64,142575,Associate Professional And Technical Occupations,grp3
250,5436,Catering and bar managers,78,81,79530,Skilled Trades Occupations,grp5
180,4129,Financial administrative occupations,79,47,42749,Administrative And Secretarial Occupations,grp4
124,3231,Youth and community workers,79,65,74526,Associate Professional And Technical Occupations,grp3
126,3234,Housing officers,79,75,59551,Associate Professional And Technical Occupations,grp3
125,3233,Child and early years officers,79,76,40434,Associate Professional And Technical Occupations,grp3
128,3239,Welfare and housing associate professionals,79,76,13839,Associate Professional And Technical Occupations,grp3
367,9274,Bar staff,79,85,208254,Elementary Occupations,grp9
178,4123,Bank and post office clerks,79,92,105670,Administrative And Secretarial Occupations,grp4
274,6215,Rail travel assistants,79.5,25,22859,"Caring, Leisure And Other Service Occupations",grp6
230,5315,Carpenters and joiners,80,17,225962,Skilled Trades Occupations,grp5
77,2316,Special needs education teaching professionals,81.25,72,83732,Professional Occupations,grp2
227,5312,Bricklayers and masons,81.5,43,97068,Skilled Trades Occupations,grp5
121,3217,Pharmaceutical technicians,83,7,25441,Associate Professional And Technical Occupations,grp3
120,3216,Dispensing opticians,83,10,10933,Associate Professional And Technical Occupations,grp3
66,2219,Health professionals,83.4,36,14472,Professional Occupations,grp2
68,2222,Occupational therapists,83.4,57,48385,Professional Occupations,grp2
65,2218,Podiatrists,83.4,80,14472,Professional Occupations,grp2
257,6123,Playworkers,84.5,45,41727,"Caring, Leisure And Other Service Occupations",grp6
256,6122,Childminders and related occupations,84.5,76,126533,"Caring, Leisure And Other Service Occupations",grp6
146,3443,Fitness instructors,84.75,31,62127,Associate Professional And Technical Occupations,grp3
273,6214,Air travel assistants,85,10,48723,"Caring, Leisure And Other Service Occupations",grp6
267,6145,Care workers and home carers,85.66666667,42,759431,"Caring, Leisure And Other Service Occupations",grp6
268,6146,Senior care workers,85.66666667,80,80614,"Caring, Leisure And Other Service Occupations",grp6
71,2231,Nurses,86,47,639206,Professional Occupations,grp2
229,5314,Plumbers and heating and ventilating engineers,87,52,212389,Skilled Trades Occupations,grp5
208,5216,Pipe fitters,87,92,12541,Skilled Trades Occupations,grp5
248,5434,Chefs,88,37,236530,Skilled Trades Occupations,grp5
259,6126,Educational support assistants,88,48,171276,"Caring, Leisure And Other Service Occupations",grp6
258,6125,Teaching assistants,88,59,298606,"Caring, Leisure And Other Service Occupations",grp6
255,6121,Nursery nurses and assistants,88,64,213889,"Caring, Leisure And Other Service Occupations",grp6
269,6147,Care escorts,88.14285714,66,16413,"Caring, Leisure And Other Service Occupations",grp6
266,6144,Houseparents and residential wardens,88.14285714,65,46453,"Caring, Leisure And Other Service Occupations",grp6
122,3218,Medical and dental technicians,88.75,77,42351,Associate Professional And Technical Occupations,grp3
64,2217,Medical radiographers,88.75,98,28244,Professional Occupations,grp2
58,2211,Medical practitioners,89.20833333,78,258842,Professional Occupations,grp2
260,6131,Veterinary nurses,90,36,23484,"Caring, Leisure And Other Service Occupations",grp6
263,6141,Nursing auxiliaries and assistants,90,78,338084,"Caring, Leisure And Other Service Occupations",grp6
61,2214,Ophthalmic opticians,90,23,19602,Professional Occupations,grp2
277,6222,Beauticians and related occupations,90.83333333,8,97568,"Caring, Leisure And Other Service Occupations",grp6
63,2216,Veterinarians,91,35,19941,Professional Occupations,grp2
276,6221,Hairdressers and barbers,91.33333333,4,161728,"Caring, Leisure And Other Service Occupations",grp6
137,3413,"Actors, entertainers and presenters",95,3,37443,Associate Professional And Technical Occupations,grp3
67,2221,Physiotherapists,96.5,37,59892,Professional Occupations,grp2
62,2215,Dental practitioners,97,50,34747,Professional Occupations,grp2
264,6142,Ambulance staff (excluding paramedics),97,47,23643,"Caring, Leisure And Other Service Occupations",grp6
72,2232,Midwives,97,98,36288,Professional Occupations,grp2
119,3213,Paramedics,97,76,25640,Associate Professional And Technical Occupations,grp3
265,6143,Dental nurses,99.5,60,52518,"Caring, Leisure And Other Service Occupations",grp6